company_id,company_name,company_type,company_url,location,telephone,product_description,about_company,product_types,all_product_services,link_prod_services,brands,link_all_brands,primary_company_type,additional_activities,key_personnel,social_media,other_locations,annual_revenue,year_founded,num_employees,url
918285,Harris,Manufacturer,https://harrisequip.com/,"Cordele, GA 31015",tel://800-468-5657,"Manufacturer of puplers, scrap cutting and chopping machinery including shears. Intended to process auto scrap, still mill scrap, pipes and plates and heavy metal. Heavy duty cylinders suitable for scrap yards.
Additional Hydraulic Cylinders details","Company Description by Thomasnet
Manufacturer of material reduction equipment including shears, balers, shredders, baler/loggers, loggers and crushers. Line of products include two ram balers, horizontal open end and closed door balers, vertical balers, pre-compaction transfer station compactors for waste, balers and a full line of scrap processing equipment. Products are for use in materials recovery facilities, for waste paper recycling, scrap paper handling for printers, converters and other scrap generators; ferrous and non-ferrous scrap metal and municipal solid waste processing plants. Inventory of used equipment & parts. Engineering, design, machining & fabrication services available as well as retrofits. Processes available for paper stock, secondary fibers, solid waste, aluminum UBC, aluminum siding/sheet, steel, non-ferrous metals, PET, HDPE, corrugated, PET, ONP, polystyrene, automobiles, & copper wire.
Company Description by Harris
In Business for over 130 years, Harris has maintained its position as the industry leader by paying attention to its customer's needs. Harris is a world class leader in the manufacturing of ferrous processing equipment: shears balers and shredders. We offer the TransPak solid waste system for MRF's, transfer stations, and other disposal facilities. Our vertical, horizontal and 2-ram balers process recovered papers, paperboard, plastics, solid waste and light ferrous and non ferrous metals. Harris supplies the right equipment for your application.

Through a careful mix of innovation seasoned by experience, Harris' engineering group continues to provide our customers with cutting edge technology to meet their processing requirements with safe, cost effective equipment.

Manufactured at one of our two state of the art facilities, the equipment we supply our customers are supported by a well-trained world wide distribution organization, reinforced by a large staff of factory technicians.

Large More... parts inventories at both distributor sites and the manufacturing plants assure our customers of prompt availability of replacement parts when needed.

 Harris' line of products includes, HRB, Gorilla, Grizzly, Badger, and Wolverine two ram balers, Harris horizontal open end and closed door balers, Vertical balers, TRANSPAK PreLoad transfer station compactors for waste, HP baler, and our full line of scrap processing equipment including BSH, ABS, GS shears, TG and TGS balers, HS series metal shredders and the new Harris PBL; portable logger baler.

 Industries where our products are used include but are not limited to MRF's, waste paper recycling; scrap paper handling for printers, converters, and other scrap generators; scrap metal both ferrous and on ferrous; and municipal solid waste processing. Less",['Cylinders: Hydraulic'],"['Recycling Machinery', 'Balers', 'Shredders', 'Compactors', 'Handling Equipment', 'Shears', 'Briquetters', 'Choppers', 'Compressors', 'Consulting Services', 'Crushers', 'Cutters and Cutting Machinery', 'Cylinders', 'Hydraulic Equipment', 'Logging Equipment', 'Machinery', 'Management Systems', 'Presses', 'Process Machinery', 'Rams', 'Transfers']",https://www.thomasnet.com/products-services.html?cov=NA&what=hydraulic+cylinders&heading=21650809&cid=918285&search_position=32&product_family=156939,"['ABS', 'Badger', 'BSH', 'Ecotecnica', 'Gorilla', 'GRIZZLY', 'GS', 'Harris', 'HRB', 'TG', 'TGS', 'TransPak', 'Wolverine']",,Manufacturer,Remanufacturer,"['Greg King, President', 'Jeff Ham, Director of Sales', 'Scott Holder, Director of Western Sales', 'Forrest Wildes, Director of Special Projects', 'Blake Brown, Regional Sales Manager', 'View All']",['http://www.harrisequip.com/company/blog/'],https://www.thomasnet.com/branches.html?what=hydraulic+cylinders&heading=21650809&cov=NA&cid=918285&bloc=NA&WTZO=copro+biz+det,Not Available,Not Available,Not Available,https://www.thomasnet.com/branchloc.html?cid=918285&cov=NA&goto=%2Fprofile%2F00918285%2Fharris.html&heading=21650809&searchpos=32&what=hydraulic+cylinders
10078881,"EAS Mold & Die Change Systems, Inc.",Manufacturer,https://easchangesystems.com/,"Greenville, SC 29605",tel://864-603-3386,"Manufacturer of single acting hydraulic pull clamp cylinders for die back plates and straight and non-fat surfaces. Available in 8 to 12 mm clamping stroke, 5,000 psi operating pressure and 5 to 200 degrees C operating temperature. Features vary depending upon model, including heavy duty, parking stations, inductive sensors and mold attachments.
Additional Hydraulic Cylinders details","Company Description by Thomasnet
Manufacturer of standard and custom clamping, mold and die handling systems and couplings. Injection units, rotators, mold tilters, die splitters, pre-rollers, transporters, mold change cars and lifters are also offered. Serves the plastic injection molding and metal stamping industries.
Company Description by EAS Mold & Die Change Systems, Inc.
EAS, formerly a division of Enerpac, designs, manufactures and sells quick mould change (QMC), quick die change (QDC) systems and mono- and multi-couplers.

These solutions improve the machine productivity and reduce unproductive downtimes, increase flexibility and safety, and reduce inventory costs dramatically, resulting in a lower manufacturing cost for you. EAS is located in the Netherlands and in the USA and has a global sales network.

Our objective is to reduce your manufacturing cost and with our partner to make you aware of your cost-saving potentials.","['Cylinders: Hydraulic', 'Cylinders', 'Cylinders: Clamping']","['Handling Equipment', 'Clamps', 'Clamping Systems', 'Lifters', 'Changers', 'Couplers and Couplings', 'Cylinders', 'Pumps', 'Rolls and Rollers', 'Rotators', 'Tables', 'Tilters', 'Transporters', 'Trucks and Carts']",https://www.thomasnet.com/products-services.html?cov=NA&heading=21650809&what=hydraulic+cylinders&cid=10078881&search_position=33&product_family=164336,,,Manufacturer,Custom Manufacturer,"['Vincent Nijzink, CEO', 'Cliff Drake, Sales Manager', 'Aaron Lael, Sales Representative', 'Andrew Lockhart, Sales Representative']",,,$1 - 4.9 Mil,2001,1-9,https://www.thomasnet.com/profile/10078881/eas-mold-die-change-systems-inc.html?cid=10078881&cov=NA&heading=21650809&searchpos=33&what=hydraulic+cylinders
455566,Carlson Tool & Manufacturing Corp.,Custom Manufacturer,https://carlsontool.com/,"Cedarburg, WI 53012",tel://800-532-2252,"Gun Drilling, Boring, Trepanning, Molds","Company Description by Thomasnet
ISO certified custom manufacturer providing engineering, tooling, drilling, and machining services. Services available include tool design & engineering, tool manufacturing, tool tryout & validation, tool service and repair, EDM, CNC machining, horizontal and vertical machining, four-axis and five-axis machining, turning, milling, deep hole drilling, gun drilling, honing, boring, parting/cutting, straight turning, contour turning, form turning, taper turning, facing, and internal/external threading. Alloy steels, aluminum, brass, bronze, carbon steel, cast iron, copper, Hastelloy, Inconel, molybdenum, Monel, nickel alloys, stainless steel, titanium, tool steel, sterling silver and bronze. Nylon, acetal, polycarbonate, polystyrene, acrylic, carbon fiber, PTFE, ABS and PVC plastic materials are handled. Tools such as plastic molds, battery/grid molds and cast metals tooling can be fabricated. Markets served include: Automotive, agricultural, military/defense, medical, railroad, food processing, marine, construction equipment, energy, mining, metals, recreation vehicles, aerospace, oil/gas, paper/plastics and more.
Company Description by Carlson Tool & Manufacturing Corp.
Since 1958, Carlson Tool & Manufacturing has grown from a simple tool and die company to the largest tooling, drilling and machining facility of its kind in North America

Carlson is an ISO certified company serving customers with engineering, tooling, drilling, and machining services. Located in Cedarburg, Wisconsin, we support your growth by providing the services you depend on for enhanced profitability and market agility. At Carlson, our goal is to act as an extension of your team and be as valuable as your top employees. If growth is your goal, count on Carlson to help you achieve it.","['Cylinders: Hydraulic', 'Cylinders', 'Cylinders: High Pressure']","['Machining', 'Milling Services', 'Inspection Services', 'Molds', 'Tooling', 'Drilling Services', 'Boring Services', 'Engineering Services', 'Honing Services', 'Maintenance and Repair Services', 'Turning Services', 'Additive Manufacturing Services', 'Aircraft Parts', 'Aluminum', 'Analytical Services', 'Casting Services', 'Collars', 'Cutting Services', 'Cylinders', 'Dies', 'Feedscrews', 'Grinding Services', 'Manifolds', 'Manufacturing Services', 'Measuring Services', 'Modeling Services']",https://www.thomasnet.com/products-services.html?cov=NA&heading=21650809&what=hydraulic+cylinders&cid=455566&search_position=34&product_family=151461,,,Custom Manufacturer,"Manufacturer, Service Company, Finishing Service Company",['Not Available'],"['https://www.linkedin.com/company/282939', 'https://www.youtube.com/channel/UCaCh4IbOH0K4MSSFMlCaNfw', 'https://www.facebook.com/Carlson-Tool-Manufacturing-Corp-315200681930452']",,$10 - 24.9 Mil,1958,100-199,https://www.thomasnet.com/profile/00455566/carlson-tool-manufacturing-corp.html?cid=455566&cov=NA&heading=21650809&searchpos=34&what=hydraulic+cylinders
435100,"Star Hydraulics, LLC",Manufacturer,https://www.starhyd.com/index.html,"River Grove, IL 60171-1501",tel://708-453-3238,"ISO 9001:2008 certified manufacturer of standard and custom hydraulic cylinders. Air-oil, double and single acting, hydro-pneumatic, multiple bore, non-rotating, smooth body, spring advance, tie-rod and welded cylinders are available. Offered in working pressure up to 15000 psi and tolerances of +/- 0.002 in. Materials used include steel, brass, aluminum, cast iron, cast steel, bronze and stainless steel. Features include adjustable stroke, corrosion proof and Hall effect and reed switch sensors. Aerospace, automotive/transportation, construction, electrical, food processing, marine, medical, mining, oil/gas/petroleum, railroad and steel industries are served. Meets ASME, ASTM, AWS and DNV standards. Meet Military Specs. RoHS compliant. 24-hour and JIT delivery services on standard products are available. Made in the USA.
Additional Hydraulic Cylinders details","Company Description by Thomasnet
ISO 9001 certified manufacturer of hydraulic cylinders, jacks & pumps including hand & foot operated pumps for pressures up to 20,000 psi. Standard and custom single or double acting manual hydraulic pumps. Custom welded cylinders to 14"" bore and 48"" stroke. Reservoirs, hand and foot operated long stroke jacks, parking meter post straighteners, & repair kits. Parts are generally carbon steel or aluminum but are available in stainless steel. Market applications include oil and gas pipelines, oil drilling rigs, material handling equipment, railroad machinery, military, aircraft support, transportation and manufacturing. In-house capability to preheat & slow cool welds as applicable for welding special alloys. Other capabilities include CNC lathes, milling & robotic welding. Applications include use in industrial plants, construction sites & remote locations for on-the-spot manual hydraulic power where emergency standby power is needed.
Company Description by Star Hydraulics, LLC
Star Hydraulics, Inc. celebrated it's 50'th anniversary in 1997. During the time that Star has been doing business, we have established ourselves as a leader in the manual hydraulic pump field offering the most complete range of standard hand and foot pumps. In addition Star offers long stroke jacks, reservoirs, parking meter post straighteners, 4-way valves, special manual pumps, and custom designed special hydraulic and pneumatic cylinders.

 Our modern 30,000 square foot manufacturing facility is conveniently located in River Grove, Illinois just minutes from all forms of transportation, including Chicago's O'Hare airport. Our shop is well equipped with CNC lathes, milling and machining centers as well as conventional engine lathes with swings up to sixty inches available for larger components, long tubes and rods. Bore mills, turret, radial and single spindle drilling machines are also utilized.

 Welding, when required is accomplished by shielded metal arc (stick), fluxcored arc, and More... gas metal arc (M.I.G.), depending on product material and configuration. We also have in house capability to preheat and slow cool welds as applicable for welding special alloys.

  Every product we build is 100% pressure tested whether it be a pump or a cylinder or a jack. No product leaves our factory without assuring that it functions properly. For over 50 years our design and engineering capability has provided the specialized knowledge and skill required to analyze, design, and solve problems relating to your special cylinder needs.

 We utilize CAD and CAM software to aid us in our engineering and manufacturing processes as well as specialized manufacturing system software to aid us in all aspects of quoting your requirements, entering, scheduling, tracking, and shipping your order. Less","['Cylinders: Hydraulic', 'Cylinders', 'Cylinders: Adjustable Stroke', 'Cylinders: Air', 'Cylinders: Air, Adjustable Stroke', 'Cylinders: Air, Double Acting, Air Operated', 'Cylinders: Air, Heavy Duty Mill Type', 'Cylinders: Air-Draulic', 'Cylinders: Aluminum', 'Cylinders: Aviation & Aerospace']","['Pumps', 'Actuators', 'Clamps', 'Cylinder Components', 'Cylinders', 'Handles, Pulls and Levers', 'Handling Equipment', 'Hydraulic Equipment', 'Jacks', 'Joints', 'Kits', 'Pump Parts', 'Reservoirs', 'Seals', 'Springs', 'Straighteners', 'Swivels', 'Tooling', 'Tools']",https://www.thomasnet.com/products-services.html?cov=NA&heading=21650809&what=hydraulic+cylinders&cid=435100&search_position=35&product_family=151761,['Star'],,Manufacturer,Custom Manufacturer,"['Keith Cauldren, Director of Sales and Marketing']",,,$1 - 4.9 Mil,1947,10-49,https://www.thomasnet.com/profile/00435100/star-hydraulics-llc.html?cid=435100&cov=NA&heading=21650809&searchpos=35&what=hydraulic+cylinders
30815189,Reasontek Corp.,Custom Manufacturer,https://www.reasontek.com/,"Brea, CA 92821",tel://323-800-6566,"Distributor of industrial hydraulic cylinders. Also offers hydraulic products such as accumulators, gearboxes, coolers, electronics, and filters. Made in the USA.
Additional Hydraulic Cylinders details","Company Description by Thomasnet
Manufacturer of bladder accumulators, ASME coded with U stamp. Products include high pressure carbon steel accumulators, low pressure accumulators with ANSI flange connection, all stainless steel accumulators, pulsation dampeners, bladder repair kits, accumulator clamps and brackets, accumulator charging kits and accumulator accessories. Design, production and service to customers internationally. Distributor of oilfield equipment and US hydraulic and industrial products including accumulators, high pressure pumps, valves, AC motors and torque wrenches. Markets served include oil and gas, automotive, construction, aviation, agriculture, marine, mining, power, food and beverage, energy, chemical and pharmaceutical, and entertainment.
Company Description by Reasontek Corp.
Manufacturer of bladder accumulators, ASME coded with U stamp. Major products include high pressure carbon steel accumulators; low pressure accumulators with ANSI flange connection; all stainless steel accumulators, pulsation dampeners, bladder repair kits, accumulator clamps and brackets, accumulator charging kits, accumulator accessories, etc.

Provide design, production and service to the customers all over the world. 

Distributor of oilfield equipment and US brand name hydraulic and industrial products including accumulators, high pressure pumps, valves, AC motors, torque wrenches, etc.

Markets served include oil and gas, automotive, construction, aviation, agriculture, marine, mining, power, food and beverage, energy, chemical and pharmaceutical, and entertainment.","['Cylinders: Hydraulic', 'Cylinders', 'Cylinders: Air', 'Cylinders: Eaton\x99', 'Cylinders: Enerpac\x99', 'Cylinders: Parker\x99']","['Motors', 'Oil and Gas Field Equipment', 'Valves', 'Accumulators', 'Dampers', 'Kits', 'Actuators', 'Adapters', 'Bearings', 'Bladders', 'Boosters', 'Brackets', 'Bushings', 'Cells', 'Chains', 'Clamps', 'Collectors', 'Computers', 'Connectors', 'Consulting Services', 'Controls and Controllers', 'Coolers', 'Couplers and Couplings', 'Cylinders']",https://www.thomasnet.com/products-services.html?cov=NA&heading=21650809&what=hydraulic+cylinders&cid=30815189&search_position=36&product_family=151462,"['Eaton', 'Enerpac', 'NoPak', 'Parker']",,Custom Manufacturer,"Distributor, Service Company",['Not Available'],['https://www.linkedin.com/company/reasontek-corporation/'],,$5 - 9.9 Mil,2009,1-9,https://www.thomasnet.com/profile/30815189/reasontek-corp.html?cid=30815189&cov=NA&heading=21650809&searchpos=36&what=hydraulic+cylinders
1082640,Metro Hydraulic,PathCOVID-19 Response,https://www.metrohydraulic.com/,"Newark, NJ 07104",tel://800-633-8234,"Distributor of double-acting hydraulic cylinders. Features vary depending upon model, including interchangeable piston head inserts, plated piston rods, high tonnage design, aluminum bronze overlay bearings, grooved ring patterns and corrosion resistance. Suitable for pulling and tensioning of cables, anchor bolts and forcing screws. Repair services and custom sizes also available.
Additional Hydraulic Cylinders details","Company Description by Thomasnet
Distributor of hydraulic tools and equipment. Various products available include cylinders, pumps, valves, jacks, pullers, wrenches, lifts, gauges, trucks, conveyors and cranes. Hydraulic, swivel, high pressure, hose, flush type, Monel, lubrication, metric and British standard pipe parallel and taper thread fittings available. Bolting, torque, tensioning, crimping, cutting, turning, stripping, hammerhead, installation, positioning, holding, locking, alignment, combination and streamline compression tools also provided. Repair services offered for hydraulic pumps, motors, cylinders and valves.","['Cylinders: Hydraulic', 'Cylinders', 'Cylinders: Abrasion Resistant', 'Cylinders: Air', 'Cylinders: Aluminum', 'Cylinders: Corrosion Proof', 'Cylinders: Custom', 'Cylinders: High Pressure', 'Cylinders: High Pressure, Locking', 'Cylinders: Hydraulic Telescopic']","['Hydraulic Equipment', 'Jacks', 'Cutters and Cutting Machinery', 'Maintenance and Repair Services', 'Hose', 'Lifts', 'Power Units', 'Actuators', 'Adapters', 'Analyzers', 'Arms', 'Assemblies', 'Attachments', 'Augers', 'Awls', 'Bags', 'Balancers', 'Barriers', 'Bars', 'Bases']",https://www.thomasnet.com/products-services.html?cov=NA&heading=21650809&what=hydraulic+cylinders&cid=1082640&search_position=37&product_family=159932,"['AirScout', 'Alemite', 'AutoQuip', 'Benwil', 'Broadcast Ready', 'Cable-Check', 'Cable-Cream', 'Cable-Gel', 'CableScout', 'Cam Track', 'Char-Lynn', 'Clear Lube', 'CoaxReady', 'Commercial', 'Data Mate', 'DataReady', 'DataScout', 'Dynamic', 'ECOA', 'Enerpac', 'ESM', 'Ford Smith', 'Forward Lift', 'G. B.', 'G3 Tugger', 'Genie', 'Hilman', 'IntelliBender', 'Jet', 'Kwik Cycle']",https://www.thomasnet.com/brands-carried.html?cov=NA&heading=21650809&what=hydraulic+cylinders&cid=1082640&search_position=37,Distributor,"Custom Manufacturer, Service Company",['Not Available'],"['https://www.linkedin.com/company/2696364?trk=tyah', 'https://www.twitter.com/metrohydraulic', 'http://www.metrohydraulic.com/blog/', 'https://www.facebook.com/160254427328444']",,Not Available,Not Available,Not Available,https://www.thomasnet.com/profile/01082640/metro-hydraulic.html?cid=1082640&cov=NA&heading=21650809&searchpos=37&what=hydraulic+cylinders
10063653,"Fluid Energy Controls, Inc.",PathCOVID-19 Response,http://fecintl.com/,"City of Industry, CA 91745",tel://323-721-0588,"Worldwide distributor of air, hydraulic & air-draulic cylinders. Other products include rotary actuators, accumulators, ball, check & cartridge valves, mounting clamps, directional control & electrohydraulic valves, filters, flow controls, fittings & gauges, gear boxes & pumps, hoses, manifolds, hydraulic & electric motors, pumps, pulsation dampeners, power units, surge suppressors, test systems & valves.
Additional Hydraulic Cylinders details","Company Description by Thomasnet
Worldwide manufacturer and designer of accumulators, surge suppressors, suction stabilizers, & pulsation dampeners. Lube oil system accumulators (LOSA) are specially designed for installation within turbo-machinery consoles and are suited to maintain normal lube oil pressure at the bearings while the standby pump accelerates from an idle condition to operating speed, or during shutdown. Specialty accumulators, pulsation dampeners and surge suppressors engineered to ASME Pressure Vessels Code Section VIII, Division I and meet API Standard 614. Capabilities include certifications to Chinese SQL, CRN or DOSH.
Company Description by Fluid Energy Controls, Inc.
Fluid Energy Controls, Inc. manufactures customized pulsation and pressure surge control products. Products include bladder accumulators, lube oil systems, and pulsation dampeners

FEC International division of Fluid Energy Controls is a global distributor of industrial air operated double diaphragm pumps, piston accumulators, pulsation and surge controllers, low speed and high torque hydraulic motors and drives, quick disconnects, hose and fitting products, and process filtration systems. Process filtration systems are used in industries such as chemical, petrochemical, photo processing, semiconductor, metalworking, paint, food processing and beverage.","['Cylinders: Hydraulic', 'Cylinders', 'Cylinders: Air', 'Cylinders: Air-Draulic', 'Cylinders: Parker\x99']","['Accumulators', 'Dampers', 'Absorbers', 'Adapters', 'Bladders', 'Brackets', 'Clamps', 'Coalescers', 'Connectors', 'Construction Equipment', 'Controls and Controllers', 'Couplers and Couplings', 'COVID-19 Response', 'Cylinders', 'Distribution Systems', 'Filters', 'Fittings', 'Flowmeters', 'Fluid Conditioning Equipment', 'Fluid Power Products', 'Gages', 'Gearheads and Gearboxes', 'Grease', 'Handling Equipment']",https://www.thomasnet.com/products-services.html?cov=NA&heading=21650809&what=hydraulic+cylinders&cid=10063653&search_position=38&product_family=155024,"['Cross', 'Parker']",,Custom Manufacturer,"Distributor, Manufacturer","['Joe Cheema, General Manager', 'Phoebe Roco, Sales Manager', 'Grand Zhao, Sales Manager']",['https://www.linkedin.com/company/fec-international-fluid-energy-controls-'],,$10 - 24.9 Mil,1995,10-49,https://www.thomasnet.com/profile/10063653/fluid-energy-controls-inc.html?cid=10063653&cov=NA&heading=21650809&searchpos=38&what=hydraulic+cylinders
