company_id,company_name,company_type,company_url,location,telephone,product_description,about_company,product_types,all_product_services,link_prod_services,brands,link_all_brands,primary_company_type,additional_activities,key_personnel,social_media,other_locations,annual_revenue,year_founded,num_employees,url
961101,"Compressed Air Systems, Inc.",PathCOVID-19 Response,https://www.compressedairsystems.com/,"Tampa, FL 33619-2658",tel://800-626-8177,"Distributor of hydraulic press cylinders for aerospace, electronics, medical, fleet maintenance, manufacturing, pharmaceutical, plastics processing, woodworking, food and beverage industries. Available in 1/2 to 4 in. size.
Additional Hydraulic Cylinders details","Company Description by Thomasnet
Distributor of compressed air systems. Various products include abrasives, adapters, air guns, analyzers, beads, bearings, blowers, air compressors, controllers, coolers, couplings, detectors, drains, dryers and exhausters. Fittings, hose, horns, indicators, kits, lights, nipples, monitors, nozzles, plugs, pumps, pump parts, receivers, regulators, separators and silencers are also available. Capabilities include inspection, preventative maintenance, installation and engineering.
Company Description by Compressed Air Systems, Inc.
We offer many products, specializing in Air Compressor, Blower and Vacuum Systems. Our sales department is backed by our own in-house service, installation and rental departments. We sell, service and rent all types of compressors, pneumatic tools and equipment. Whether it's pumps or tools, our complete repair facility insures quick turn-around for your convenience. We service all makes and models and provide Consulting and Engineering services for new Compressed Air and Vacuum Systems, as well as improving existing systems.","['Cylinders: Hydraulic', 'Cylinders', 'Cylinders: High Pressure', 'Cylinders: Press', 'Cylinders: Pressure']","['Compressors', 'Chillers', 'Pumps', 'Filters', 'Abrasive Blast Equipment', 'Compressor Parts', 'Generators', 'Sensors / Detectors / Transducers', 'Tanks', 'Cleaning Equipment', 'Oils', 'Vacuum Systems', 'Air Filtration Equipment & Supplies', 'COVID-19 Response', 'Dryers', 'Lubricants', 'Openers', 'Receivers', 'Regulators', 'Solid Film Lubricants', 'Adapters', 'Blowers', 'Brewers', 'Bushings']",https://www.thomasnet.com/products-services.html?cov=NA&what=hydraulic+cylinders&heading=21650809&cid=961101&search_position=16&product_family=151847,"['Airman', 'Airtech', 'Ajax', 'Anderol', 'Apollo', 'Atlas Copco', 'Becker', 'Busch', 'Cejn', 'Champion', 'Chicago Pneumatic', 'Clemco', 'CompAir', 'Curtis', 'Curtis-Toledo', 'Deitech', 'Deltech', 'Desoutter', 'Diffuser', 'Dotco', 'Duro', 'Dwyer', 'Econoblast', 'Elmo Rietschle', 'Foster', 'FST', 'Gardner Denver', 'Genera', 'Goodall', 'Graco']",https://www.thomasnet.com/brands-carried.html?cov=NA&what=hydraulic+cylinders&heading=21650809&cid=961101&search_position=16,Distributor,"Manufacturer, Custom Manufacturer, Service Company","['Richard Hall, President', 'Walter Freeman, Vice-President', 'N.A. Hall, Secretary', 'P.J. Hall, Treasurer', 'Henry Freeman, General Manager', 'View All']","['https://www.linkedin.com/company/compressed-air-systems-inc-', 'https://www.twitter.com/CompAirSystems', 'http://aircompressors.compressedairsystems.com/blog', 'https://www.youtube.com/channel/UCvBeoqWzNlu4x5P-hmiK0AA/feed', 'https://www.facebook.com/CAS1963']",https://www.thomasnet.com/branches.html?what=hydraulic+cylinders&heading=21650809&cov=NA&cid=961101&bloc=NA&WTZO=copro+biz+det,Not Available,1963,50-99,https://www.thomasnet.com/branchloc.html?cid=961101&cov=NA&goto=%2Fprofile%2F00961101%2Fcompressed-air-systems-inc.html&heading=21650809&searchpos=16&what=hydraulic+cylinders
120500,Dunham Rubber & Belting Corp.,Distributor,https://www.dunhamrubber.com/,"Greenwood, IN 46143",tel://800-876-5340,"Manufacturer and distributor of hydraulic cylinders. Types include aluminum, double and single acting, flat body, high tonnage, hollow hole, lock nut, low profile, pull and threaded. Available with 1.26 in. to 36.13 in. collapsed height and 2 ton to 1,000 ton cylinder capacity. Features vary depending upon different models. Some features include handles, piston rods, alloy bearings, scratching and corrosion resistance, base mounting holes, rod wipers, heavy duty compression springs, mechanical safety lock nuts, chrome plated ram and plunger ends. Suitable for pushing, pulling, lifting and holding loads, high cycling in production and tensioning applications.
Additional Hydraulic Cylinders details","Company Description by Thomasnet
Industrial distributor, fabricator & manufacturer of a wide range of belting products & services, including; European style light duty, plied rubber belts, monofilament, material handling, food grade, polyurethane, thermoplastic & PVC belting. Lacing distributor for all mechanical fastener needs. Offer on-site belt installation for truly endless applications. Hydraulic distributor for all hose, fitting & adapter needs. Products for air, water & chemical applications. Sheet rubber products including neoprene, gum & silicone rubber. Custom made urethane products.
Company Description by Dunham Rubber & Belting Corp.
Dunham Rubber and Belting Corp. distributes, fabricates, and manufactures industrial rubber products, including but not limited to conveyor belting, hose and fittings, molded and extruded rubber/urethane parts, gaskets, and seals. It has always been our desire to use our expertise to understand our customers' processes and provide real solutions to their needs, domestically and internationally.","['Cylinders: Hydraulic', 'Cylinders', 'Cylinders: Aluminum', 'Cylinders: Corrosion Proof', 'Cylinders: High Pressure', 'Cylinders: Press', 'Cylinders: Pressure']","['Hose', 'Couplers and Couplings', 'Belts', 'Adapters', 'Bushings', 'Caps', 'Connectors', 'Crosses', 'Elbows', 'Fittings', 'Nipples', 'Plugs and Stoppers', 'Stems', 'Tees', 'Unions', 'Rubber', 'Gaskets', 'Cutting Services', 'Conduits and Ducts', 'Conveyors', 'COVID-19 Response', 'Fasteners']",https://www.thomasnet.com/products-services.html?cov=NA&what=hydraulic+cylinders&heading=21650809&cid=120500&search_position=17&product_family=151604,"['AdvantaPure', 'Aeroquip', 'Alligator', 'Alpha', 'American Biltrite', 'American Packing', 'Ammeraal Beltech', 'Apache Mills', 'AQP', 'Arc Latch', 'ASGCO', 'Bailey-Parks', 'Banjo', 'Belt Concepts', 'Bio-Flex', 'BioClosure', 'Boston', 'Bradford', 'Breco', 'BRECOflex', 'Brennan', 'Carflex', 'Chantland', 'Chemfluor', 'Chemprene', 'CLEARFLO', 'Coilhose', 'Coiltef', 'Corroflon', 'Cush-A-Clamp']",https://www.thomasnet.com/brands-carried.html?cov=NA&what=hydraulic+cylinders&heading=21650809&cid=120500&search_position=17,Distributor,"Manufacturer, Custom Manufacturer, Service Company","['Gary Buchanan, President', 'James Wainwright, Vice President', 'Mike Francis, National Sales Manager', 'Suzanne Lee, Product Marketing']",,https://www.thomasnet.com/branches.html?what=hydraulic+cylinders&heading=21650809&cov=NA&cid=120500&bloc=NA&WTZO=copro+biz+det,Not Available,1965,50-99,https://www.thomasnet.com/branchloc.html?cid=120500&cov=NA&goto=%2Fprofile%2F00120500%2Fdunham-rubber-belting-corp.html&heading=21650809&searchpos=17&what=hydraulic+cylinders
30309904,OTP Industrial Solutions,Distributor,https://www.otpnet.com/,"Columbus, OH 43219",tel://614-342-6123,"Distributor of pneumatic & hydraulic cylinders in standard & metric dimensions. Types of cylinders include special, mill & welded style cylinders. Various features include stroke adjusters, optional stop tubes, piston rods, honed steel tubing, position indicators, distance sensing switches, rod wipers & rod boots. Meets JIC & NFPA requirements. On-time delivery.
Additional Hydraulic Cylinders details","Company Description by Thomasnet
Distributor of fluid handling, electrical, hydraulic, mechanical & finishing components. Pumps, bearings & repair services for pumps are also available. Types of pumps include submersible, sealless magnetic driven, metering, internal & external gear, multi-stage centrifugal, vertical turbine, air-operated diaphragm, two & three screw, plunger & piston pumps. Fluid power products include pneumatic cylinders, actuators, tubing & fittings, vacuum & air preparation equipment & valves. Linear motion components, AC/DC motors & drives, motors, sensors & cables, I/O & HMI meters, enclosures, transformers, PLC's, controllers, crane systems, gear reducers, gearmotors, bearings, sprockets, shaft couplings, sheaves, bushings, gearings, belts, motorized pulleys, chains, fluid regulators, spray, steaming & extruding guns, tanks, agitators & mixers are also available. Industries served include power & utility, steel, automotive, food & beverage, OEM & general. On-time delivery.","['Cylinders: Hydraulic', 'Cylinders', 'Cylinders: Air', 'Cylinders: Adjustable Stroke', 'Cylinders: Air, Heavy Duty Mill Type', 'Cylinders: Air, Metric', 'Cylinders: Aluminum', 'Cylinders: Custom', 'Cylinders: Eaton\x99', 'Cylinders: Heavy Duty, Mill Type']","['Pumps', 'Motors', 'Actuators', 'Bearings', 'Maintenance and Repair Services', 'Booths', 'Couplers and Couplings', 'Cylinders', 'Filters', 'Finishing Equipment', 'Gearheads and Gearboxes', 'Seals', 'Valves', 'Applicators', 'Bushings', 'Chains', 'Clutches', 'Conveyors', 'Gears', 'Guns']",https://www.thomasnet.com/products-services.html?cov=NA&what=hydraulic+cylinders&heading=21650809&cid=30309904&search_position=18&product_family=151761,"['Eaton', 'Georgia Hydraulic', 'Lynair', 'Tolomatic']",,Distributor,"Custom Manufacturer, Service Company, Finishing Service Company, Turnkey Systems Integrator",['Not Available'],,https://www.thomasnet.com/branches.html?what=hydraulic+cylinders&heading=21650809&cov=NA&cid=30309904&bloc=NA&WTZO=copro+biz+det,$100 - 249.9 Mil,1963,500-999,https://www.thomasnet.com/branchloc.html?cid=30309904&cov=NA&goto=%2Fprofile%2F30309904%2Fotp-industrial-solutions.html&heading=21650809&searchpos=18&what=hydraulic+cylinders
20053642,Emerson Bearing,Distributor,https://www.emersonbearing.com/,"Boston, MA 02134",tel://800-225-4587,"Manufacturer of hydraulic cylinders. Hydraulic pumps also available. Other products include bearings, mounted units, seals, chains, rollers, bushings, and other bearing accessories. Same day shipment.
Additional Hydraulic Cylinders details","Company Description by Thomasnet
Distributor of precision, roller and ball bearings and related products including oil seals, cam followers and spherical bushings. Bearing accessories such as adhesives, sealants, power transmission belts and mounting tools are available. Bearings and cam followers can be modified to meet specifications. Blanket orders accepted. 24 hour services available. Same day delivery. JIT shipments.
Company Description by Emerson Bearing
Emerson Bearing, located in Brighton, Massachusetts, has sold bearings to OEMs and maintenance/repair users since 1957. Today, we employ over 30 people and sell bearings and related items throughout the United States as well as international markets. We have over 3 million bearings in our centrally located distribution center. 

As one of the first bearing importers, we have a unique knowledge of where and how to find the right bearings in the worldwide market.","['Cylinders: Hydraulic', 'Cylinders', 'Cylinders: Enerpac\x99']","['Bearings', 'Chains', 'Adhesives', 'Anti-Seize', 'Belts', 'Blocks', 'Bushings', 'Calipers', 'Caps', 'Collars', 'Compounds', 'Connectors', 'Corrosion Resistant Products', 'Couplers and Couplings', 'Cylinders', 'Electrical Equipment', 'Ends', 'Fasteners', 'Fittings', 'Flanges', 'Followers', 'Grease', 'Hook and Loop', 'Housings', 'Inserts', 'Lubricants']",https://www.thomasnet.com/products-services.html?cov=NA&heading=21650809&what=hydraulic+cylinders&cid=20053642&search_position=19&product_family=151466,"['Enerpac', 'SPX']",,Distributor,,['Not Available'],"['https://www.linkedin.com/company/emerson-bearing', 'https://www.twitter.com/EmersonBearing', 'https://blog.emersonbearing.com/blog', 'https://www.youtube.com/user/emersonbearing', 'https://www.facebook.com/EmersonBearing']",,Not Available,Not Available,Not Available,https://www.thomasnet.com/profile/20053642/emerson-bearing.html?cid=20053642&cov=NA&heading=21650809&searchpos=19&what=hydraulic+cylinders
1310161,Atlas Bronze,Distributor,https://www.atlasbronze.com/Default.asp,"Trenton, NJ 08611",tel://800-478-0887,"Distributor of machine parts including hydraulic cylinders. Cylinders are machined by hand, power tools and CNC machines. Serves the manufacturing, aerospace, architectural, oil, gas, power generation plant, marine and naval industries.
Additional Hydraulic Cylinders details","Company Description by Thomasnet
Distributor of brass, bronze and iron products in the form of sheet, plate, bar, wire, round, rod, rectangle, strip and finished machined parts. Manganese bronze, tin bronze, leaded tin bronze, aluminum bronze, nickel aluminum bronze, silicon aluminum bronze, phosphor bronze and silicon manganese bronze available. Free cutting brass, naval brass, red brass and yellow brass offered. Available casting methods include sand or static casting, centrifugal casting or continuous casting. Also offers bronze wrought products and bronze forgings.   Finished machine parts include bearings, hydraulic cylinders, cams, cam slide bushings, gears and cam or gear blanks. Serves the manufacturing, aerospace, architectural, oil, gas, power generation plant, marine and naval industries.","['Cylinders: Hydraulic', 'Cylinders', 'Cylinders: Aviation & Aerospace', 'Cylinders: Marine', 'Cylinders: Special']","['Casting Services', 'Bushings', 'Forging Services', 'Bars', 'Bearings', 'Blanks', 'Blocks', 'Brass', 'Brazing Alloys', 'Bronze', 'Cams', 'Copper', 'Cylinders', 'Fabrication Services', 'Fasteners', 'Fixtures', 'Gears', 'Iron (Metal)', 'Job Shop Services', 'Liners', 'Machinery Parts', 'Metals', 'Miscellaneous Metals', 'Nuts']",https://www.thomasnet.com/products-services.html?cov=NA&heading=21650809&what=hydraulic+cylinders&cid=1310161&search_position=20&product_family=152409,,,Distributor,"Manufacturer, Custom Manufacturer","['Josh Smith, VP Sales', 'Tom Smith, Owner']",,,$5 - 9.9 Mil,1994,10-49,https://www.thomasnet.com/profile/01310161/atlas-bronze.html?cid=1310161&cov=NA&heading=21650809&searchpos=20&what=hydraulic+cylinders
128196,Industrial Brake & Supply,Custom Manufacturer,https://www.indbrake.com/index.html,"Walton, KY 41094",tel://800-543-1906,"Distributor of hydraulic master braking cylinders. Other products include linings, calipers, and drum brakes. Industries served include construction, agriculture, and industry.
Additional Hydraulic Cylinders details","Company Description by Thomasnet
Custom manufacturer and distributor of specialty friction & brake shoe assemblies for all off-highway & in-plant applications including molded & woven rolls of brake lining, flat sheets & arced slabs & industrial brakes for a wide variety of heavy duty, light duty, wet & dry industrial applications. Industries served include off-highway, agricultural, mining, in-plant, overhead cranes, hoists & golf carts. Products include clutch & frictions for cranes & shovels, drilled, keylock & undrilled wheel brakes, disc pads, calipers, pistons, springs, boots, overhaul kits, repair kits & gear tooth facings.
Company Description by Industrial Brake & Supply
Whether your application is construction, mining, milling, manufacturing or transportation, Industrial Brake & Supply offers you a single source for all your industrial brake and friction materials requirements. 

We are custom fabricator of specialty friction and brake shoe assemblies for all off-highway and in-plant applications including molded and woven rolls of brake lining, flat sheets and arced slabs, and industrial brakes for a wide variety of both heavy duty and light duty industrial applications. 

With over 25 years' experience in the friction materials industry, we produce industrial brakes in our shop with custom bonding and riveting capabilities by experienced and highly trained employees. 

We can fabricate industrial brake parts and assemblies per your drawings to supply finished parts.","['Cylinders: Hydraulic', 'Cylinders', 'Cylinders: Braking & Locking', 'Cylinders: Master']","['Friction Materials', 'Brakes', 'Liners', 'Crane Parts', 'Cranes', 'Clutches', 'Pads', 'Bands', 'Bonding Services', 'Plates', 'Shoes', 'Assemblies', 'Automotive Parts', 'Bearings', 'Blocks', 'Bushings', 'Calipers', 'Controls and Controllers', 'Cylinders', 'Discs', 'Facings', 'Pistons', 'Sheets', 'Wheels']",https://www.thomasnet.com/products-services.html?cov=NA&heading=21650809&what=hydraulic+cylinders&cid=128196&search_position=21&product_family=154358,"['Carlisle', 'Champion', 'Ferotec', 'Hawkhead', 'Redco']",,Custom Manufacturer,"Distributor, Manufacturer",['Not Available'],,,$10 - 24.9 Mil,1971,10-49,https://www.thomasnet.com/profile/00128196/industrial-brake-supply.html?cid=128196&cov=NA&heading=21650809&searchpos=21&what=hydraulic+cylinders
10020565,"Jergens, Inc.",Manufacturer,https://www.jergensinc.com/,"Cleveland, OH 44110",tel://216-486-2100,"ISO 9001: 2000 certified manufacturer & distributor of intensifier cylinders including air cylinders & hydraulic cylinders. Intensifier cylinders available as a combination of air & hydraulic cylinders.
Additional Hydraulic Cylinders details","Company Description by Thomasnet
ISO 9001:2015 and AS9100 Rev D certified manufacturer & distributor of workholding systems & tooling components for the production environment. Products include quick change fixturing, workholding components, locating components, metric products, pins, handles, knobs, handwheels, lifting products such as center-pull & side-pull hoist rings, toggle clamps, power clamping systems, drill bushings, maintenance tools, chuck jaws, mounting systems & clamps.
Company Description by Jergens, Inc.
Since our founding Jergens, Inc. has grown to comprise 3 distinct business units: workholding solutions, lifting solutions and specialty fasteners. Building on its reputation of uncompromising quality standards, Jergens is committed to helping its customers achieve leaner, more profitable manufacturing, and continues to add products and engineered solutions for an integrated approach to ""manufacturing efficiency.""

Today, you'll find our tooling components, fasteners and hoist rings at work in just about every industry on every continent. And our innovative engineered solutions like the patented Ball Lock mounting system have changed the way manufacturers worldwide think about productivity.

We manufacture over 80% of what we sell right here in our 130,000 sq. ft. Cleveland, OH facility, guaranteeing you high quality, competitive pricing and immediate availability (or fast turnaround times on special items). We are a big user of our own products and can set up lean cells to accommodate More... lot sizes from 1 to 10,000, thanks to our own tooling components and engineered products.

 So when it comes to lean manufacturing we practice what we preach here at Jergens...Manufacturing efficiency. Less",['Cylinders: Hydraulic'],"['Workholding Systems', 'Pins', 'Rings', 'Tooling', 'Clamps', 'Fixtures', 'Plungers', 'Vises', 'Balls', 'Bolts', 'Bushings', 'Chucks and Collets', 'Clamping Systems', 'Couplers and Couplings', 'Cylinders', 'Fasteners', 'Fluids', 'Handles, Pulls and Levers', 'Hoist Parts', 'Hoists', 'Holders', 'Hooks', 'Hose', 'Hydraulic Equipment', 'Inserts', 'Knobs', 'Levelers', 'Miscellaneous Fittings']",https://www.thomasnet.com/products-services.html?cov=NA&what=hydraulic+cylinders&heading=21650809&cid=10020565&search_position=22&product_family=156813,,,Manufacturer,"Distributor, Custom Manufacturer","['Darel Taylor, Engineering Mgr.', 'Bob Kucinic, National Sales Manager LSG & SFG Division / Key Accounts Manager', 'Jack Schron Jr, President', 'J.H. Schron, Sr., Chmn.']","['https://www.linkedin.com/company/jergens-inc.', 'https://www.twitter.com/JergensInc', 'https://www.jergensinc.com/blog', 'https://www.youtube.com/user/Jergensinc', 'https://www.facebook.com/JergensInc']",https://www.thomasnet.com/branches.html?what=hydraulic+cylinders&heading=21650809&cov=NA&cid=10020565&bloc=NA&WTZO=copro+biz+det,$50 - 99.9 Mil,1942,100-199,https://www.thomasnet.com/branchloc.html?cid=10020565&cov=NA&goto=%2Fprofile%2F10020565%2Fjergens-inc.html&heading=21650809&searchpos=22&what=hydraulic+cylinders
10076166,Applied Power Solutions,Distributor,https://www.apscorp.com,"Addison, IL 60101",tel://888-277-9901,"Distributor of hydraulic and pneumatic products including cylinders. Repair, engineering, troubleshooting and preventative maintenance services are offered. Value added services such as custom barcoding, CAD capabilities, OEM assembly, plant surveys and third party logistics are also provided. Serves the metal processing, metal service center, paper mill and paper converting, canning, grinding, commercial laundry, marine, oil and gas and material handling industries. Vendor managed inventory (VMI) programs available. Kanban delivery.
Additional Hydraulic Cylinders details","Company Description by Thomasnet
Distributor of fluid power and industrial automation products. Clutch, brake, valve, cylinder, pneumatic, hydraulic and power transmission products available. Types of brakes include caliper disc, combination of clutch and brakes, centrifugal, electromagnetic, hydraulic, pneumatic, mechanical, tension, torque limiting, low inertia spring set and water cooled. Backstop, centrifugal, magnetic, electromagnetic, hydraulic, mechanical, overrunning, pneumatic, tension, power take-off, low inertia and torque limiting clutches are provided. Clutch and brake repair, on-site product solutions and preventative maintenance services also offered. Serves the metal processing, metal service center, paper mill and paper converting, canning, grinding, commercial laundry, marine, oil and gas and material handling industries. 24-hour emergency services and vendor managed inventory (VMI) programs available. Kanban delivery.","['Cylinders: Hydraulic', 'Cylinders', 'Cylinders: Pneumatic']","['Benders', 'Brakes', 'Hose', 'Actuators', 'Clutches', 'Gearheads and Gearboxes', 'Power Transmission Equipment', 'Controls and Controllers', 'Motor Controllers and Drives', 'Filters', 'Fluid Conditioning Equipment', 'Manifolds', 'Motors', 'Power Units', 'Separators', 'Valves', 'Accumulators', 'Airlocks', 'Barrels and Drums', 'Bearings', 'Bushings', 'Buttons', 'Clutch Parts', 'Connectors', 'Couplers and Couplings', 'Curtains']",https://www.thomasnet.com/products-services.html?cov=NA&heading=21650809&what=hydraulic+cylinders&cid=10076166&search_position=23&product_family=151649,"['Boston Gear', 'Carlson-Powerflo', 'CSA', 'Desch', 'Eaton', 'Excelon', 'Fawick', 'Formsprag', 'Herion', 'IMI Norgren', 'Kamco', 'Kebco', 'Marland', 'Micro-Fog', 'NLS', 'Planox', 'Power Flo', 'Power Grip', 'PTO', 'SKD', 'Stieber', 'Triad', 'Ultra-VC', 'VC', 'Warner Electric', 'WPT']",,Distributor,Service Company,['Not Available'],,,Not Available,1996,Not Available,https://www.thomasnet.com/profile/10076166/applied-power-solutions.html?cid=10076166&cov=NA&heading=21650809&searchpos=23&what=hydraulic+cylinders
