company_id,company_name,company_type,company_url,location,telephone,product_description,about_company,product_types,all_product_services,link_prod_services,brands,link_all_brands,primary_company_type,additional_activities,key_personnel,social_media,other_locations,annual_revenue,year_founded,num_employees,url
10066154,Eaton - Hydraulics,Manufacturer,http://www.eaton.com/,"Eden Prairie, MN 55344",tel://800-386-1911,"Manufacturer and distributor of standard and custom heavy duty mill type hydraulic cylinders made from steel. Available in 3 in. to 30 in. bore sizes with stroke up to 24 ft. with 5000 psi pressure. Features include high-yield strength and bearing and threaded flange design. Capabilities include engineering, assembly, machining, boring, deburring, project management and repair. Various applications include arc furnaces, slab casters, rolling mills and coating lines.","Company Description by Thomasnet
Manufacturer of standard and custom industrial hydraulic, electrical and mechanical power systems. Various products include absorbers, accumulators, actuators, adapters, brakes, breathers, clamps, columns, connectors, controls, cylinders, elevators, filters, fittings, power steering systems, regulators, pumps, motors, generators and valves. Capabilities include engineering, assembly, machining, boring, deburring, project management and repair. Aerospace, electrical, automotive, agriculture, military, mining, government and various industries served.
Company Description by Eaton - Hydraulics
Eaton is a global technology leader in power management. For more than a century, our mission has been to make hydraulic, electrical and mechanical power systems operate efficiently, effectively, safely and sustainably. Our industry-leading distribution network extends to virtually every corner of the globe. Our ability to partner with our customers to develop custom-tailored solutions for their exact needs is legendary. And were one of the only companies in the world with both hydraulic and electrical solutions in one placesimplifying one more aspect of an increasingly complex world.","['Cylinders: Hydraulic', 'Cylinders', 'Cylinders: Air', 'Cylinders: Air, Double Acting, Air Operated', 'Cylinders: Hydraulic Telescopic', 'Cylinders: Hydraulic, Adjustable Stroke', 'Cylinders: Hydraulic, Position Sensing', 'Cylinders: Mill Type, Hydraulic', 'Cylinders: Spring Return', 'Cylinders: Stainless Steel']","['Absorbers', 'Accumulators', 'Actuators', 'Adapters', 'Airlocks', 'Analytical Services', 'Axles', 'Benches', 'Benders', 'Bladders', 'Blocks', 'Blowers', 'Boosters', 'Brakes', 'Breakers', 'Breathers', 'Buffers', 'Bushings', 'Capsules', 'Chucks and Collets']",https://www.thomasnet.com/products-services.html?cov=NA&what=hydraulic+cylinders&heading=21650809&cid=10066154&search_position=358&product_family=157526,['Hydro-Line'],,Manufacturer,"Distributor, Custom Manufacturer, Service Company",['Not Available'],"['https://www.linkedin.com/company/2602?trk=tyah&trkInfo=tarId%3A1404843520186%2Ctas%3Aeaton%20hydraulics%2Cidx%3A2-2-5', 'https://www.twitter.com/etn_hydraulics', 'https://www.youtube.com/channel/UCF7vz2IAPNHv7BKTiFC9Xhw', 'https://www.facebook.com/eatoncorporation']",https://www.thomasnet.com/branches.html?what=hydraulic+cylinders&heading=21650809&cov=NA&cid=10066154&bloc=NA&WTZO=copro+biz+det,$250 Mil. and over,1911,1000+,https://www.thomasnet.com/branchloc.html?cid=10066154&cov=NA&goto=%2Fprofile%2F10066154%2Featon-hydraulics.html&heading=21650809&searchpos=358&what=hydraulic+cylinders
30703197,"Anker-Holth Ltd., Div. of Magnum Integrated Technologies Inc.",Manufacturer,http://www.ankerholth.com,"Brampton, ON L6W4T5",tel://800-387-3834,,"Company Description by Thomasnet
Manufacturer of high performance hydraulic systems and components for motion control and fluid power applications. Products include cylinders and complete hydraulic systems. Serving the aluminum casting, steel mill, bridge, dam, material handling, power generation, mining, marine and offshore markets.","['Cylinders: Hydraulic', 'Cylinders: Hydraulic, Civil Engineering', 'Cylinders: Pneumatic']",['Cylinders'],https://www.thomasnet.com/products-services.html?cov=NA&heading=21650809&what=hydraulic+cylinders&cid=30703197&search_position=359&product_family=157625,,,Manufacturer,Custom Manufacturer,['Not Available'],,,$10 - 24.9 Mil,1953,10-49,https://www.thomasnet.com/profile/30703197/ankerholth-ltd-div-of-magnum-integrated-technologies-inc.html?cid=30703197&cov=NA&heading=21650809&searchpos=359&what=hydraulic+cylinders
347234,Westfield Hydraulics Inc.,Manufacturer,http://www.westfieldhydraulics.com/,"Pacoima, CA 91331-1685",tel://818-896-6414,"Custom manufacturer of hydraulic and pneumatic cylinders for aerospace and defense industries. Capable of handling hydraulic oils, solvent, and pneumatic fluids up to 1500 psi. Tolerances include +/- 0.010 in. for parts and +/- 0.001 in. for components. Materials used include carbon steel, stainless steel, aluminum, plastics, and elastomers. Applications include hydraulic fluid power equipment, thrust reverser valves, high pressure solenoid valves, fueling systems, and nose steering systems. Capabilities include CNC machining, turning, milling, EDM, grinding, honing, lapping, and welding. Services such as inspection, testing, documentation, and FAA certified repair, retrofitting, and overhauling services are available. Meet Mil-Spec requirements.","Company Description by Thomasnet
Custom manufacturer of engineered, precision hydraulic and fluid control components for aerospace and defense industries. Products include multi-position hydraulic solenoid valves, motor operated valves, check and non-return valves, relief valves, manifolds, hydraulic actuators, thrust reverser valves, cylinders, accumulators, proximity, flow and pressure switches, and reservoir tanks. Materials used include carbon steel, stainless steel, aluminum, copper, plastics, and elastomers. Applications include hydraulic fluid power equipment, thrust reverser valves, high pressure solenoid valves, fueling systems, and nose steering systems. Capabilities include CNC machining, turning, milling, EDM, grinding, honing, lapping, and welding. Services such as inspection, testing, documentation, and FAA certified repair, retrofitting, and overhauling services are available. Meet Mil-Spec requirements.
Company Description by Westfield Hydraulics Inc.
Westfield Hydraulics, Inc. was formed in 1974 to be an industry leader in the design, manufacture, assembly, and testing of powered and non-powered valves, solenoids, and fluid controls for aerospace and defense applications.

First designing and manufacturing for H.R. Textron, the company has grown to producing thousands of engineered designs, including solenoid valves, multi-position hydraulic solenoid valves, check and non-return valves, relief valves, manifolds, hydraulic actuators, thrust reverser valves, accumulators, reservoir tanks, and provided various custom design manufacturing for companies including Boeing, Bombardier, Honeywell, Lockheed, Northrop Grumman, Parker, BAE systems, Scaled Composites, the Department of Defense, and many others.

What we offer:

 Custom Engineered Solutions

 Vertically integrated Manufacturing

 WIP visibility and Transparency via MRP (finite scheduled)

 Rapid Prototyping

 Qualification Testing

 FAA Repair Station with unlimited accessory class More... 1 & 2 rating

  Robust Quality Management System Less","['Cylinders: Hydraulic', 'Cylinders', 'Cylinders: Custom', 'Cylinders: Pneumatic']","['Accumulators', 'Actuators', 'Aircraft Parts', 'Controls and Controllers', 'Cylinders', 'Electromechanical Devices', 'Hydraulic Equipment', 'Maintenance and Repair Services', 'Manifolds', 'Military Equipment', 'Regulators', 'Sensors / Detectors / Transducers', 'Solenoids', 'Switches', 'Tanks', 'Testing Services', 'Thrust Reversers', 'Valves']",https://www.thomasnet.com/products-services.html?cov=NA&heading=21650809&what=hydraulic+cylinders&cid=347234&search_position=360&product_family=155024,,,Manufacturer,"Custom Manufacturer, Service Company",['Not Available'],['https://www.twitter.com/WESTFIELDweb'],,$1 - 4.9 Mil,1974,10-49,https://www.thomasnet.com/profile/00347234/westfield-hydraulics-inc.html?cid=347234&cov=NA&heading=21650809&searchpos=360&what=hydraulic+cylinders
1184014,Mack Corp.,Manufacturer,http://www.mackcorp.com,"Flagstaff, AZ 86004",tel://928-526-1120,,"Company Description by Thomasnet
Manufacturer of hydraulic and pneumatic cylinders for industrial automation applications. Flanged, single acting, double acting, lug mounted, vacuum and spring return cylinders are available. Other products include pneumatic grippers and vacuum level compensators are also offered. Custom parts available.","['Cylinders: Hydraulic', 'Cylinders', 'Cylinders: Flanged', 'Cylinders: Miniature', 'Cylinders: Pneumatic', 'Cylinders: Rotating', 'Cylinders: Spring Return', 'Cylinders: Vacuum']","['Compensators', 'Cylinders', 'Grippers']",https://www.thomasnet.com/products-services.html?cov=NA&heading=21650809&what=hydraulic+cylinders&cid=1184014&search_position=361&product_family=155103,,,Manufacturer,,"['Rukky Ziregbe, Marketing']",,,Under $1 Mil,1970,10-49,https://www.thomasnet.com/profile/01184014/mack-corp.html?cid=1184014&cov=NA&heading=21650809&searchpos=361&what=hydraulic+cylinders
1210033,"A.R.M. USA, Inc.",Custom Manufacturer,https://www.armusainc.com/,"Wintersville, OH 43953-7640",tel://740-264-6599,,"Company Description by Thomasnet
Custom manufacturer of valves, hoses, automations, hydraulic and mechanical products. Power units, cylinders, operated caliper brakes, panels, touch displays, flanges, bolts, AC inverter drives, controls, power distribution, slew ring bearings, drivelines, motors, planetary gearboxes and piping are offered. Fabrication, painting, coating, manufacturing and design services are also provided. Works with aluminum, stainless steel, acrylic and zinc. materials. Serves the metal processing, oil and gas industries.",['Cylinders: Hydraulic'],"['Bearings', 'Boring Services', 'Brakes', 'Coating Services', 'Controls and Controllers', 'Cylinders', 'Displays', 'Fabrication Services', 'Frames', 'Gearheads and Gearboxes', 'Hoists', 'Hose', 'Manufacturing Services', 'Milling Services', 'Motor Controllers and Drives', 'Painting Services', 'Pipes', 'Platforms', 'Pumps', 'Stairs', 'Trailers', 'Valves']",https://www.thomasnet.com/products-services.html?cov=NA&heading=21650809&what=hydraulic+cylinders&cid=1210033&search_position=362&product_family=151466,,,Custom Manufacturer,Finishing Service Company,"['David Gill, Pres.']",,,$100 - 249.9 Mil,1996,10-49,https://www.thomasnet.com/profile/01210033/arm-usa-inc.html?cid=1210033&cov=NA&heading=21650809&searchpos=362&what=hydraulic+cylinders
30878173,Water Quest Solutions,Manufacturer,https://www.waterquestsolutions.com/,"Richmond, BC V6V2H9",tel://604-227-4339,,"Company Description by Thomasnet
Manufacturer and distributor of water hydraulic systems, components and control equipment. Products include actuators, cylinders, diamond coated seals, air motors, pumps, power-packs, control valves, manual valves, pilot operated check valves, pressure control valves and pressure reducing valves. Accessories such as pressure gauges, bell housing, couplings, heat-exchangers, filters, tanks, accumulators, water fittings, pipes and tubes are also offered. Suitable for marine, water desalination, food and beverage, mining, offshore, steel mills, forestry, bilge pump and air motor applications.","['Cylinders: Hydraulic', 'Cylinders', 'Cylinders: Special']","['Accumulators', 'Actuators', 'Couplers and Couplings', 'Cylinders', 'Exchangers', 'Filters', 'Fittings', 'Gages', 'Housings', 'Hydraulic Equipment', 'Manifolds', 'Motors', 'Other Fire Fighting Equipment', 'Pipes', 'Power Units', 'Pumps', 'Reservoirs', 'Seals', 'Tanks', 'Valves', 'Wildfire Response']",https://www.thomasnet.com/products-services.html?cov=NA&heading=21650809&what=hydraulic+cylinders&cid=30878173&search_position=363&product_family=155024,,,Manufacturer,Distributor,"['Bruce Hickin, Sales Mgr.', 'Mike Fenn, Sales Mgr.']",,,Not Available,Not Available,Not Available,https://www.thomasnet.com/profile/30878173/water-quest-solutions.html?cid=30878173&cov=NA&heading=21650809&searchpos=363&what=hydraulic+cylinders
63993,"Hydraquip, Inc.",Distributor,https://www.hydraquip.com/,"Houston, TX 77092",tel://713-680-1951,"Stocking distributor of hydraulic cylinders. Types of hydraulic cylinders include single or double acting, telescopic, solid & hole-thru rods & double rod end. Hydraulic cylinders are pressures up to 15000 psi, capacities to 1500 tons, bores to 24 in. & strokes up to 20 ft. Hydraulic cylinders are available with stroke indicating devices.","Company Description by Thomasnet
Stocking distributor of fluid power equipment including hydraulic equipment, pneumatic equipment, marine equipment, electrical equipment & hose & fittings. Products include accumulators, actuators, brakes, couplings, cylinders, filters, gages, gear boxes, hand pumps, heat exchangers, hydrostatic transmissions, lubricators, manifold packages, motors, power units, pumps, steering units, steering systems, valves, sensors, clamps, joystick, tubing clamps, signal conditioners & controls. Capabilities include repair, reconditioning, engineering & testing for hydraulic & pneumatic components. Circuit & system layout design services available. Serves the fluid power industry.",['Cylinders: Hydraulic'],"['Accumulators', 'Actuators', 'Adapters', 'Brakes', 'Clamping Systems', 'Clamps', 'Conditioners', 'Connectors', 'Controls and Controllers', 'Couplers and Couplings', 'Cylinder Components', 'Cylinders', 'Engineering Services', 'Exchangers', 'Fabrication Services', 'Filters', 'Fittings', 'Flanges', 'Fluid Conditioning Equipment', 'Gages', 'Gearheads and Gearboxes', 'Hose', 'Hydraulic Equipment', 'Integration Services', 'Joysticks', 'Lubricators', 'Maintenance and Repair Services', 'Manifolds']",https://www.thomasnet.com/products-services.html?cov=NA&what=hydraulic+cylinders&heading=21650809&cid=63993&search_position=364&product_family=155024,"['Star', 'Vickers']",,Distributor,"Custom Manufacturer, Service Company, Turnkey Systems Integrator",['Not Available'],,https://www.thomasnet.com/branches.html?what=hydraulic+cylinders&heading=21650809&cov=NA&cid=63993&bloc=NA&WTZO=copro+biz+det,$50 - 99.9 Mil,1951,50-99,https://www.thomasnet.com/branchloc.html?cid=63993&cov=NA&goto=%2Fprofile%2F00063993%2Fhydraquip-inc.html&heading=21650809&searchpos=364&what=hydraulic+cylinders
20097318,Ats Workholding,Manufacturer,https://www.ats-s.com/,"Rancho Santa Margarita, CA 92688",tel://800-321-1833,,"Company Description by Thomasnet
Manufacturer of work holding devices. Products such as rotary index tables, bar feeds, pallet changers, air, power and collet chucks, hydraulic cylinders, steady rests and jaws are available.","['Cylinders: Hydraulic', 'Cylinders', 'Cylinders: Workholding']","['Changers', 'Chucks and Collets', 'Cylinders', 'Jaws', 'Positioners', 'Rests', 'Tables', 'Wallets', 'Workholding Systems']",https://www.thomasnet.com/products-services.html?cov=NA&heading=21650809&what=hydraulic+cylinders&cid=20097318&search_position=365&product_family=157391,,,Manufacturer,,['Not Available'],,,$1 - 4.9 Mil,Not Available,10-49,https://www.thomasnet.com/profile/20097318/ats-workholding.html?cid=20097318&cov=NA&heading=21650809&searchpos=365&what=hydraulic+cylinders
10092371,Basin Custom Machining Ltd.,Custom Manufacturer,https://basinmachine.ca/,"Sudbury, ON P3B2Z3",tel://705-673-1878,,"Company Description by Thomasnet
Custom manufacturer of OEM and aftermarket mining equipment components and hydraulic cylinders and driveshaft. Capabilities include fabrication, thermal spray welding and CNC machining. Markets served include mining, logging and industrial.",['Cylinders: Hydraulic'],"['Cylinders', 'Fabrication Services', 'Job Shop Services', 'Machining', 'Manufacturing Services', 'Welding Services']",https://www.thomasnet.com/products-services.html?cov=NA&heading=21650809&what=hydraulic+cylinders&cid=10092371&search_position=366&product_family=157625,,,Custom Manufacturer,"Manufacturer, Service Company",['Not Available'],,,$1 - 4.9 Mil,Not Available,10-49,https://www.thomasnet.com/profile/10092371/basin-custom-machining-ltd.html?cid=10092371&cov=NA&heading=21650809&searchpos=366&what=hydraulic+cylinders
1170699,Quest Engineering,Distributor,https://www.questenginc.com/,"Minneapolis, MN 55426",tel://800-328-4853,"Distributor of cylinders for the power generation industry. Electrohydraulic/mechanical, hydraulic and pneumatic cylinders are offered. Vendor management inventory, kit fabrication, barcoding, assembly, custom packaging, labeling, parts testing, and training services are available.","Company Description by Thomasnet
Distributor of fluid connector solutions. Products include thermoplastic and hydraulic hose, fittings, instrumentation products, quick couplings, and ball valves. Offers vendor management inventory (VMI) and bin-stocking programs, barcoding, product and component drawing, and custom packaging and labeling.
Company Description by Quest Engineering
Quest Engineering is a customer focused distributor of hydraulic and instrumentation products. We deliver the parts our customers need when they need them accurately. We are a leading Parker distributor with locations in Minnesota, South Dakota, North Dakota and Iowa. Our 45+ years of experience and ISO 9001:2008 certification makes us the distributor of choice for leading manufacturing companies in the Upper Midwest.","['Cylinders: Hydraulic', 'Cylinders', 'Cylinders: Pneumatic']","['Accumulators', 'Actuators', 'Adapters', 'Checkers', 'Connectors', 'Controls and Controllers', 'Couplers and Couplings', 'Crimpers', 'Cylinders', 'Dehydrators', 'Dies', 'Elbows', 'Electric Wire, Cable and Cable Assemblies', 'Filters', 'Fittings', 'Flowmeters', 'Fluid Conditioning Equipment', 'Gages', 'Heaters', 'Hose', 'Hydraulic Equipment', 'Instruments', 'Joints', 'Machinery', 'Manifolds', 'Meters']",https://www.thomasnet.com/products-services.html?cov=NA&what=hydraulic+cylinders&heading=21650809&cid=1170699&search_position=367&product_family=155024,"['Atlas Cylinders', 'Miller']",,Distributor,,['Not Available'],['https://www.linkedin.com/company/quest-engineering/'],https://www.thomasnet.com/branches.html?what=hydraulic+cylinders&heading=21650809&cov=NA&cid=1170699&bloc=NA&WTZO=copro+biz+det,$25 - 49.9 Mil,1971,50-99,https://www.thomasnet.com/branchloc.html?cid=1170699&cov=NA&goto=%2Fprofile%2F01170699%2Fquest-engineering.html&heading=21650809&searchpos=367&what=hydraulic+cylinders
30829100,JJET Enterprises,Manufacturer,http://www.jjetenterprises.com/,"Livermore, CA 94551",tel://925-447-7177,,"Company Description by Thomasnet
Manufacturer of precision aircraft parts for air force and foreign militaries. Products include hydraulic and electro-mechanical actuators, airframe parts, hydraulic pumps and cylinders, flight controls, lighting systems, constant speed drives, windshield assemblies, landing lights and gears, gearboxes, antennas, hydraulics airframe skins, thrust reversers, propellers, canopies, restraints, electric motors, pylons and stabilizers.","['Cylinders: Hydraulic', 'Cylinders']","['Actuators', 'Aircraft Parts', 'Airframes', 'Antennas', 'Assemblies', 'Controls and Controllers', 'Cylinders', 'Engine Parts', 'Gearheads and Gearboxes', 'Gears', 'Landing Systems', 'Lights', 'Motors', 'Propellers', 'Pumps', 'Pylons', 'Restraints', 'Stabilizers', 'Thrust Reversers']",https://www.thomasnet.com/products-services.html?cov=NA&heading=21650809&what=hydraulic+cylinders&cid=30829100&search_position=368&product_family=152449,,,Manufacturer,,"['James Thomas, Founder', 'Judson Thomas, Founder', 'Naomi Thomas, Founder']",,,Not Available,Not Available,Not Available,https://www.thomasnet.com/profile/30829100/jjet-enterprises.html?cid=30829100&cov=NA&heading=21650809&searchpos=368&what=hydraulic+cylinders
195617,Phillips Steel Co.,Distributor,https://www.phillipssteel.com/,"Long Beach, CA 90813",tel://562-435-7571,"Distributor of hydraulic cylinders. Types of hydraulic cylinders include single acting light weight spring return steel cylinders, flat jack spring return steel cylinders & steel low profile jack spring return cylinders. Hydraulic cylinders have 5 tons, 10 tons, 15 tons, 20 tons & 25 tons capacities. 24 hrs emergency service available.","Company Description by Thomasnet
Steel supply distributor and service center offering steel, aluminum, stainless steel and galvanized metal. Capabilities include plasma cutting, flame cutting, plate and sheet shearing, bar/pipe threading, welding, punching, band saw cutting, drilling, rolling, forming and water jet cutting. Also a distributor of wheels, chemicals, safety equipment, tool belts, bags, material handling equipment, welding accessories and supplies. Various types of tools available include power, hand, cordless and precision. 24 hour emergency service.",['Cylinders: Hydraulic'],"['Abrasive Compounds / Media', 'Adapters', 'Aluminum', 'Angles', 'Bags', 'Batteries', 'Beams', 'Belts', 'Bending Services', 'Bits', 'Blades', 'Brass', 'Brushes', 'Calipers', 'Caps', 'Carbon', 'Channels', 'Clamps', 'Cleaning Equipment', 'Clothing', 'Construction Equipment', 'Copper', 'COVID-19 Response', 'Cutting Services', 'Cylinders', 'Dividers', 'Drilling Services', 'Drills']",https://www.thomasnet.com/products-services.html?cov=NA&heading=21650809&what=hydraulic+cylinders&cid=195617&search_position=369&product_family=152428,['Simplex'],,Distributor,"Custom Manufacturer, Finishing Service Company",['Not Available'],['http://allaboutphillipssteel.blogspot.com/'],,$10 - 24.9 Mil,1915,10-49,https://www.thomasnet.com/profile/00195617/phillips-steel-co.html?cid=195617&cov=NA&heading=21650809&searchpos=369&what=hydraulic+cylinders
