company_id,company_name,company_type,company_url,location,telephone,product_description,about_company,product_types,all_product_services,link_prod_services,brands,link_all_brands,primary_company_type,additional_activities,key_personnel,social_media,other_locations,annual_revenue,year_founded,num_employees,url
1166920,M & M Rogness Equipment Co.,Distributor,http://www.mmrogness.com/index.html,"Roseville, MN 55113",tel://651-633-0550,"Distributor of hydraulic type cylinders including pancake type, aluminum, brass & stainless steel cylinders. Cylinders are available with 150 psi to 3,000 psi operating pressure & 3/4 in. to 20 in. bores.
Additional Hydraulic Cylinders details","Company Description by Thomasnet
Distributor of cylinders, pumps & valves. Bladder & piston accumulators, filter bags, baskets, filter carts, couplings, filters, fillers, filter, pressure & sight gages, heaters, lubricators, electric motors, regulators, pressure snubbers & suction strainers are also available. Accessories include adapters, brackets, gaskets, plugs, sockets, spacers & switches. Capabilities include designing, system layout, troubleshooting & hydraulic & pneumatic cylinder repair.","['Cylinders: Hydraulic', 'Cylinders: Pneumatic', 'Cylinders', 'Cylinders: Aluminum', 'Cylinders: Corrosion Proof', 'Cylinders: Flanged', 'Cylinders: High Pressure', 'Cylinders: Metal', 'Cylinders: Parker\x99', 'Cylinders: Pressure']","['Cylinders', 'Accumulators', 'Adapters', 'Bags', 'Baskets', 'Boat and Ship Parts', 'Brackets', 'Breathers', 'Caps', 'Couplers and Couplings', 'Drainage Systems', 'Drains', 'Engineering Services', 'Filters', 'Fittings', 'Flanges', 'Fluid Power Products', 'Gages', 'Gaskets', 'Heaters']",https://www.thomasnet.com/products-services.html?cov=NA&heading=21650809&what=hydraulic+cylinders&cid=1166920&search_position=8&product_family=157625,"['Aurora', 'Aurora Air Products', 'Greer', 'Kep-O-seal', 'Kepner', 'Kepsel', 'LeSac', 'Ortman', 'Parker', 'Quick Seal']",https://www.thomasnet.com/brands-carried.html?cov=NA&heading=21650809&what=hydraulic+cylinders&cid=1166920&search_position=8,Distributor,,['Not Available'],,,$1 - 4.9 Mil,1947,10-49,https://www.thomasnet.com/profile/01166920/m-m-rogness-equipment-co.html?cid=1166920&cov=NA&heading=21650809&searchpos=8&what=hydraulic+cylinders
1200093,Oil-Air Products,Distributor,http://www.oilair.com,"Plymouth, MN 55441",tel://877-779-0967,"Distributor of hydraulic cylinders for food processing, machine tool, marine, material handling, medical equipment, construction, infrastructure, transportation, energy, defense, petroleum, biotechnology, pharmaceutical, recycling, packaging, oil and gas industries. Made from steel, aluminum and stainless steel materials. Available in 1 1/8 to 24 in. bore size with custom up to 54 in. Tie rod, welded, telescoping, intensifier and mill type cylinders are offered. JIT delivery.
Additional Hydraulic Cylinders details","Company Description by Thomasnet
Distributor of fluid power products including accumulators, actuators, adapters, breathers, cylinders, filters, fittings, flowmeters, motors, power units, mounts and orifices. Pumps, hose, sensors, detectors, transducers, gages, thermometers, exchangers, joysticks, injectors and coolers are available. Valves, swivels, tubes, regulators, seals and strainers are also offered. Hose assembly fabrication and repair services are provided. Manifolds, hydraulic hose assemblies and lubrication systems are customizable. Serves the food processing, machine tool, marine, material handling, medical equipment, construction, infrastructure, transportation, energy, defense, petroleum, biotechnology, pharmaceutical, recycling, packaging, oil and gas industries. JIT delivery.
Company Description by Oil-Air Products
Our Philosophy

The Oil-Air Products mission is clear. Partner with our customer to offer a unique, quality solution that gives them a competitive edge in their marketplace. We have partnered with the world's leading fluid power manufacturers to ensure that the solution we provide is taking advantage of the latest in fluid power technology and our experienced team is factory trained to integrate and support these products. We understand that our customers have many choices and we look forward to the opportunity to earn your business.

Our History

Since our inception in 1983, Oil-Air Products has been focused on fluid power technical expertise and experience to provide leading edge, quality solutions to our customers. Over the years we have grown to include complete system design and fabrication for the mobile and industrial markets, hose assembly fabrication, fluid power component sales, value added solutions, on-site installation, service and repair. With our continued success and our reputation More... as the Fluid Power Specialists, we continue to expand our corporate capabilities. We recently transitioned to a new 62,000 square foot facility in Plymouth, MN and have also expanded a part of our hose fabrication to a new Willmar, MN location.

 Our People

 At Oil-Air Products, our people are truly our most valuable asset. We have a highly experienced team of degreed fluid power specialists that can assist in all applications of fluid power products. Ongoing education in all aspects of fluid power for our people is key to making sure we are promoting and using the latest in fluid power technology. You can feel confident that you will be working with a team of friendly professionals who have years of experience on providing unique solutions that will give you a competitive edge in your marketplace. Less","['Cylinders: Hydraulic', 'Cylinders', 'Cylinders: Air', 'Cylinders: Aluminum', 'Cylinders: Custom', 'Cylinders: Hydraulic Telescopic', 'Cylinders: Industrial Gas', 'Cylinders: Intensifier', 'Cylinders: ISO', 'Cylinders: Machine Tool']","['Hose', 'Maintenance and Repair Services', 'Valves', 'Manifolds', 'Power Units', 'Pumps', 'Cylinders', 'Hydraulic Equipment', 'Accumulators', 'Actuators', 'Adapters', 'Automation Systems', 'Breathers', 'Cells', 'Clamps', 'Controls and Controllers', 'Coolers', 'Corrosion Resistant Products', 'Counters', 'Couplers and Couplings']",https://www.thomasnet.com/products-services.html?cov=NA&heading=21650809&what=hydraulic+cylinders&cid=1200093&search_position=9&product_family=151604,"['Anchor Fluid Power', 'Comatrol', 'Cross', 'Daman', 'Danfoss', 'Dinamic', 'Donaldson', 'Gates', 'Graco', 'HYDAC', 'Hydronic', 'IMI Norgren', 'Lenz', 'Lodar', 'Manuli', 'Marzocchi', 'Moog', 'Noshok', 'Oilgear', 'Olaer', 'Radiomatic', 'SAI', 'Sheffer', 'Stauff', 'Viking']",,Distributor,"Custom Manufacturer, Service Company",['Not Available'],"['https://www.linkedin.com/company/oil-air-products-llc/about/?viewAsMember=true', 'https://www.twitter.com/OilAirLLC', 'https://www.youtube.com/channel/UCn44NetZ8KV6BiRt6IjXurw', 'https://www.facebook.com/oilairproducts']",,$25 - 49.9 Mil,1983,50-99,https://www.thomasnet.com/profile/01200093/oilair-products.html?cid=1200093&cov=NA&heading=21650809&searchpos=9&what=hydraulic+cylinders
10070932,"Hader, Inc.",Distributor,http://www.haderind.com/index.html,"New Berlin, WI 53151",tel://866-780-2091,"Custom manufacturer & distributor of hydraulic side shift cylinders for material handling applications. Type of cylinders include power steering & tilt cylinders. Remanufactured & new cylinders are also available.
Additional Hydraulic Cylinders details","Company Description by Thomasnet
Custom manufacturer & distributor of hydraulic components for material handling applications. Hydraulic components include cylinders, pumps, valves, steer gears, actuators, torque generators, control units & orbitrols. Remanufactured & new hydraulic components are also available. Capabilities include remanufacturing, testing & repairing.
Company Description by Hader, Inc.
Hader Incorporated has been supplying the material handling industry quality remanufactured and manufactured hydraulic components for almost 50 years. Through attention to detail and in-house manufacturing, Hader insures the quality of the components it sells.","['Cylinders: Hydraulic', 'Cylinders', 'Cylinders: Booster', 'Cylinders: Heavy Duty, Mill Type', 'Cylinders: Hydraulic Telescopic', 'Cylinders: Hydro-Pneumatic', 'Cylinders: Lift & Tilt', 'Cylinders: Machine Tool', 'Cylinders: Pressure', 'Cylinders: Pump, Double Acting']","['Maintenance and Repair Services', 'Power Units', 'Pumps', 'Valves', 'Hydraulic Equipment', 'Cylinders', 'Actuators', 'Automotive Parts', 'Controls and Controllers', 'Gears', 'Generators', 'Power Transmission Equipment', 'Steering Systems']",https://www.thomasnet.com/products-services.html?cov=NA&heading=21650809&what=hydraulic+cylinders&cid=10070932&search_position=10&product_family=161669,"['Allis-Chalmers', 'Caterpillar', 'Clark']",,Distributor,"Manufacturer, Custom Manufacturer","['James Hader, Pres.', 'Wayne Werner, CEO', 'Paul Piotrowski, CFO']",,,$1 - 4.9 Mil,1951,10-49,https://www.thomasnet.com/profile/10070932/hader-inc.html?cid=10070932&cov=NA&heading=21650809&searchpos=10&what=hydraulic+cylinders
701643,Airoyal Division of Delta Sales,Manufacturer,http://www.airoyal.com,"Butler, NJ 07405",tel://877-535-9535,"Manufacturer of medium duty and heavy duty hydraulic cylinders. Available in stainless steel, hastelloy, titanium materials and more. Products are interchangeable with standard industry mountings and are available with magnetic pistons with switches. Custom design capabilities are available.
Additional Hydraulic Cylinders details","Company Description by Thomasnet
Manufacturer of medium duty and heavy duty cylinders available in air, hydraulic and pneumatic types. Available in stainless steel, hastelloy, titanium materials and more. Products are interchangeable with standard industry mountings and are available with Magnetic Pistons with Switches. Custom design capabilities are available.","['Cylinders: Hydraulic', 'Cylinders: Pneumatic', 'Cylinders', 'Cylinders: Air', 'Cylinders: Heavy Duty, Mill Type', 'Cylinders: Stainless Steel', 'Cylinders: Titanium']",['Cylinders'],https://www.thomasnet.com/products-services.html?cov=NA&heading=21650809&what=hydraulic+cylinders&cid=701643&search_position=11&product_family=157625,,,Manufacturer,,['Not Available'],,,$1 - 4.9 Mil,1938,1-9,https://www.thomasnet.com/profile/00701643/airoyal-division-of-delta-sales.html?cid=701643&cov=NA&heading=21650809&searchpos=11&what=hydraulic+cylinders
42468,Robeck Fluid Power Co.,Distributor,https://www.robeckfluidpower.com/,"Aurora, OH 44202",tel://800-541-4655,"Distributor of hydraulic and pneumatic NFPA/JIC cylinders. Capable of CAD design, engineering, and hydraulic cylinder repair. Serves the commercial and industrial markets. In-house machining, assembly, maintenance, troubleshooting, and installation services are available for products.
Additional Hydraulic Cylinders details","Company Description by Thomasnet
Distributor of electronic, hydraulic, lubrication, and pneumatic tools and devices. Products include safety interlock switches, motor controls, sensors, filter assemblies, and regulators. Capable of CAD design and engineering. Serves the commercial and industrial markets. In-house machining and component repair, assembly, maintenance, troubleshooting, and installation services are available for products.
Company Description by Robeck Fluid Power Co.
Robeck Fluid Power Co. was founded in Solon, Ohio (a Cleveland suburb), by Peter W. Becker in May 1983. In 1985, Robeck began its relationship with the Robert Bosch Corporation. During the next few years, Robeck devoted the majority of its resources to developing a Bosch presence in both the steel and plastic industries. Because of these efforts, Robeck became one of Bosch's largest distributors. In 2001, Bosch and Rexroth formed Bosch Rexroth AG. With this change, Robeck ended its long relationship with Bosch and formed a new relationship with Eaton Corporation as a fully authorized distributor for Eaton, Char-Lynn, Hydro-Line, and Vickers.

In December 1995, Robeck moved to a new 35,000-square-foot facility located in Aurora, Ohio. With 45 employees and the addition of world-class suppliers and disciplines, Robeck continues to provide its customers with quality products and service on a repeat basis.","['Cylinders: Hydraulic', 'Cylinders', 'Cylinders: Eaton\x99', 'Cylinders: NFPA Standard', 'Cylinders: Pneumatic', 'Cylinders: Rodless']","['Conveyors', 'Power Units', 'Hydraulic Equipment', 'Automation Systems', 'Cylinders', 'Electronic Components', 'Pneumatic Systems', 'Pumps', 'Accumulators', 'Actuators', 'Adapters', 'Air Filtration Equipment & Supplies', 'Amplifiers', 'Balancers', 'Balls', 'Bases', 'Batteries', 'Bearings', 'Bolts', 'Brackets', 'Breathers', 'Bushings', 'Buttons', 'Cameras']",https://www.thomasnet.com/products-services.html?cov=NA&heading=21650809&what=hydraulic+cylinders&cid=42468&search_position=12&product_family=151613,"['Eaton', 'Farval', 'HYDAC', 'Hydro-Line', 'Vickers']",,Distributor,"Manufacturer, Custom Manufacturer, Service Company","['Peter Becker, President', 'Philipp Becker, Vice-President', 'Ida Becker, Treas.', 'Mike Cohn, Customer Services Mgr.', 'Bob Long, Engineering Mgr.']",,,$10 - 24.9 Mil,1983,50-99,https://www.thomasnet.com/profile/00042468/robeck-fluid-power-co.html?cid=42468&cov=NA&heading=21650809&searchpos=12&what=hydraulic+cylinders
1286332,Kinnear Specialties,Distributor,http://www.kinnearspecialties.com/index.html,"St Helens, OR 97051",tel://888-643-7167,"Distributor of hydraulic cylinders. Cushioned, air, pneumatic, mounted, intensifier & loaded cylinders are also available. Hydraulic cylinders are available in 1 1/2 in. to 24 in. bore sizes & 3,500 psi operating pressure.
Additional Hydraulic Cylinders details","Company Description by Thomasnet
Manufacturer of custom built hydraulic systems. Distributor of bladder piston & diaphragm accumulators, hydraulic dampeners, replacement bladders, tube & pipe clamps, hydraulic & pneumatic cylinders, tube, pipe, hose & hose end fittings, brass & steel fittings & adapters, low pressure to very high pressure hose & hose ends, gage blocks, pumps, sensors, pressure switches, transducers, ball, check, flow control, servo, proportional, solenoid cartridge & pressure control cartridge valves & flanges. Hydraulic parts & accessories such as breathers, filler breathers, fluid level indicators, gauge isolators & test points are also available.
Company Description by Kinnear Specialties
Kinnear Specialties Inc. is a family-owned small business. Our highly experienced people offer tremendous expertise in fluid power. We care about our customers needs and work hard to find solutions to your problems. 

We proudly offer many fine product lines as your authorized distributor for Anchor Flange, CC Jensen, Hydac International, Herion, Eaton-Weatherhead, PCI Purakal, Daman, Thermal Transfer, Inserta, Nacol, and Duplomatic.

See our Kinnear specialties product page for unique fittings and adapters. Our large warehouse stock ensures rapid shipping to your location!","['Cylinders: Hydraulic', 'Cylinders: Air', 'Cylinders: Pneumatic']","['Adapters', 'Cylinders', 'Fittings', 'Hydraulic Equipment', 'Filters', 'Flanges', 'Power Units', 'Accumulators', 'Actuators', 'Benders', 'Blocks', 'Breathers', 'Clamps', 'Controls and Controllers', 'Conveyors', 'Cranes', 'Dampers', 'Exchangers', 'Expanders', 'Extractors', 'Fluid Conditioning Equipment', 'Fluids', 'Hoists', 'Hose', 'Indicators', 'Maintenance and Repair Services']",https://www.thomasnet.com/products-services.html?cov=NA&heading=21650809&what=hydraulic+cylinders&cid=1286332&search_position=13&product_family=161425,['Purakal'],,Distributor,"Manufacturer, Custom Manufacturer",['Not Available'],,,$1 - 4.9 Mil,1969,1-9,https://www.thomasnet.com/profile/01286332/kinnear-specialties.html?cid=1286332&cov=NA&heading=21650809&searchpos=13&what=hydraulic+cylinders
326009,Royal Hydraulics,Distributor,https://www.royalhydraulics.com/,"Northridge, CA 91325",tel://888-333-7692,"Manufacturer of hydraulic type cylinders. Specifications include up to 5000 psi pressure rating and 1.50 through 20.00 bore as aluminum and steel bodied. Available in light, medium and heavy duty NFPA extruded tube or tie rod construction.
Additional Hydraulic Cylinders details","Company Description by Thomasnet
Manufacturer & distributor of hydraulic & pneumatic equipment, systems, power units, tools & accessories covering a broad range of applications in a variety of production processes. Performance, reliability, & durability product capabilities. Products include accumulators, pumps, valves, filter, fittings, hose, oil coolers, pressure gages, reservoirs, flow meters, motors & cylinders. Involved in design, engineering, repair, service & testing options of all major makes & models of pumps, valves, cylinders & motors.
Company Description by Royal Hydraulics
Royal Hydraulics, Inc. (RHI) is a privately owned company, which was founded in 1982. Our mission is to supply, design, and manufacture cost effective solutions for ""Customer Specific"" applications, by working in close partnership with each and every client, and by using and providing industry proven, leading edge technology. Our company's capabilities are a result of exclusively utilizing only products that excel in performance, reliability, and durability, which are then backed up by RHI's passion and commitment to customer service and innovative thinking that come from years of extensive application and industry experience. 

RHI Initially focused on equipment for specific production requirements. Later, drawing on the knowledge gained from experience, RHI began supplying systems and a complete line of hydraulic equipment to fulfill the system elements either of our own designs, or those of our customers. 

Today, many years, and thousands of projects later, RHI is a recognized industry More... leader, that is deeply committed to supplying hydraulic equipment, systems, power units, tools and accessories that cover a broad range of applications in a variety of production processes. 

 RHI's customers include some of the most recognizable names in business, as well as a large number of well-known smaller regional and local companies. All of our customers, regardless of their size, have one thing in common... they all share a firm desire for the high quality and superior product support that has become, and will continue to be, the trademark of Royal Hydraulics, Inc. Less","['Cylinders: Hydraulic', 'Cylinders', 'Cylinders: Adjustable Stroke', 'Cylinders: Air', 'Cylinders: Air, Double Acting, Air Operated', 'Cylinders: Eaton\x99', 'Cylinders: Flanged', 'Cylinders: High Pressure', 'Cylinders: Hydraulic, Adjustable Stroke', 'Cylinders: Large Bore']","['Cylinders', 'Power Units', 'Exchangers', 'Filters', 'Hydraulic Equipment', 'Pumps', 'Sensors / Detectors / Transducers', 'Accumulators', 'Actuators', 'Adapters', 'Air Filtration Equipment & Supplies', 'Airlocks', 'Analytical Services', 'Bags', 'Bearings', 'Bladders', 'Brakes', 'Chillers', 'Clamps', 'Clutches']",https://www.thomasnet.com/products-services.html?cov=NA&heading=21650809&what=hydraulic+cylinders&cid=326009&search_position=14&product_family=157625,"['Air-Dro', 'Aurora', 'AZZ', 'Benshaw', 'Brennan', 'Cehvron', 'Chevron', 'Continental', 'Dayco', 'Delta', 'Delta Power', 'Deublin', 'DMIC', 'Dynex', 'Eaton', 'Flo Ezy', 'Flow-Tech', 'Goodyear', 'Hedland', 'Helicoid', 'Hellan', 'Hilco', 'Hydro-Craft', 'Hydro-Line', 'Hydroline', 'Hyflow', 'Internormen', 'Kaocrete HPM', 'L.F. Manufacturing', 'Lincoln']",https://www.thomasnet.com/brands-carried.html?cov=NA&heading=21650809&what=hydraulic+cylinders&cid=326009&search_position=14,Distributor,"Manufacturer, Custom Manufacturer, Manufacturers' Rep, Service Company, Turnkey Systems Integrator",['Not Available'],"['https://www.twitter.com/royalhydraulics', 'https://www.facebook.com/royalhydraulics']",,$1 - 4.9 Mil,1982,10-49,https://www.thomasnet.com/profile/00326009/royal-hydraulics.html?cid=326009&cov=NA&heading=21650809&searchpos=14&what=hydraulic+cylinders
564168,"Modern Fluid Power, Inc.",Distributor,https://www.modernfluidpowerinc.com/,"Blanchester, OH 45107",tel://888-711-1889,"Stocking distributor of hydraulic cylinders. Specifications of cylinders vary depending upon models & include steel tie rods with 100,000 psi to 125,000 psi minimum yield strength & 3,000 psi rated pressure. Various features of cylinders include air bleeders, NPTF ports, double lip wipers, glass fiber-filled PTFE piston seals & O-ring tube end seals.
Additional Hydraulic Cylinders details","Company Description by Thomasnet
Stocking distributor of industrial valves & components for OEM, MRO's, pipe-valve supply houses & process industries. Products include actuators, backflow preventers, brackets, gauges, manifolds, mufflers, cocks, connectors, presses, regulators, sensors, strainers, controls, cylinders, couplings, switches, tanks, cylinders, filters, fittings, thermometers, thermowells, valves, lubricators, hydraulic equipment & lubrication components. Valve automation services are also available.
Company Description by Modern Fluid Power, Inc.
Modern Fluid Power Inc. is a distributor of industrial valves and components for industry. We specialize in the selection of product which best serves customer application requirements. Our market includes the industrial O.E.M, MRO's, pipe-valve supply houses, and process industries.

Our assortment of select manufacturing suppliers allows us a broad and varied product mix. Products include: most all types of industrial valves, air and hydraulic cylinders, components such as strainers, pressure gauges, fittings and many more. Visit our products page for more details.

Valve Actuation is an important part of our business. As any actuation distributor for Apollo/Conbraco, we stock, assemble and test a complete pneumatic or electric actuation package.

WE ARE PRODUCT SPECIALISTS AND OFFER THE PROPER PRODUCTS FROM NUMEROUS MANUFACTURERS TO SATISFY CUSTOMER APPLICATION REQUIREMENTS.","['Cylinders: Hydraulic', 'Cylinders', 'Cylinders: Air', 'Cylinders: Air Tandem', 'Cylinders: Air, Heavy Duty Mill Type', 'Cylinders: Aluminum', 'Cylinders: Custom', 'Cylinders: Heavy Duty, Mill Type', 'Cylinders: High Pressure', 'Cylinders: Mill Type, Hydraulic']","['Pumps', 'Strainers', 'Actuators', 'Flowmeters', 'Automation Services', 'Controls and Controllers', 'Couplers and Couplings', 'Cylinders', 'Filters', 'Fittings', 'Fluid Conditioning Equipment', 'Gages', 'Handling Equipment', 'Hydraulic Equipment', 'Lubricators', 'Maintenance and Repair Services', 'Manifolds', 'Mufflers', 'Pipe Fittings', 'Pneumatic Systems']",https://www.thomasnet.com/products-services.html?cov=NA&heading=21650809&what=hydraulic+cylinders&cid=564168&search_position=15&product_family=151761,['Lynair'],,Distributor,"Custom Manufacturer, Service Company, Turnkey Systems Integrator",['Not Available'],,,$1 - 4.9 Mil,1970,1-9,https://www.thomasnet.com/profile/00564168/modern-fluid-power-inc.html?cid=564168&cov=NA&heading=21650809&searchpos=15&what=hydraulic+cylinders
