company_id,company_name,company_type,company_url,location,telephone,product_description,about_company,product_types,all_product_services,link_prod_services,brands,link_all_brands,primary_company_type,additional_activities,key_personnel,social_media,other_locations,annual_revenue,year_founded,num_employees,url
10099744,"Advanced Fluid Systems, Inc.",Custom Manufacturer,https://advancedfluidsystems.com/,"York, PA 17402",tel://866-500-1941,"ISO-9001:2015 certified manufacturer and distributor of hydraulic cylinders. Double acting metric hydraulic cylinders, double acting NFPA metric hydraulic cylinders, rod less cable style hydraulic cylinders & mill type hydraulic cylinders are available.
Additional Hydraulic Cylinders details","Company Description by Thomasnet
ISO-9001:2015 certified manufacturer and distributor of standard & custom hydraulic power units, motion control systems, electronic controls, hydraulic & pneumatic components, integrated manifolds, lubrication systems, filtration equipment & fluid power products. Accumulators, cylinders, drivers & reducers, electromechanical actuators, rotary actuators, heat exchangers, aluminum extrusion products, heaters, hydraulic motors, pumps, sensors, valves, winches/hoists & accessories are available. Other products include amplifier cards, connectors/cables, radio remote controls & servo drives. Remanufactured piston pumps are also available. Services include repairing, hydraulic purifier rentals, field installation, start-up, troubleshooting & hydraulic fluid testing. Hydraulic pump/motor, cylinder, proportional/servo valve & accumulator repairing services are available. Installation services include hydraulic power unit & component installation, system to PLC wiring & integration & hose & tubing layout designing & prototyping.
Company Description by Advanced Fluid Systems, Inc.
Advanced Fluid Systems, a 9001:2015 Certified Company, is a leading fluid power distributor and systems manufacturer with three locations in the Mid-Atlantic region. Founded by an engineer, our sales and manufacturing departments are experienced electrical and mechanical engineers who provide service and support wherever our customers go. These qualities and some of the most respected product brands in the industry are the reason why our customers are so successful.","['Cylinders: Hydraulic', 'Cylinders', 'Cylinders: Pneumatic', 'Cylinders: Rodless']","['Power Units', 'Pumps', 'Controls and Controllers', 'Lubricators', 'Valves', 'Maintenance and Repair Services', 'Hydraulic Equipment', 'Engineering Services', 'Filters', 'Fluid Conditioning Equipment', 'Accumulators', 'Actuators', 'Adapters', 'Analytical Services', 'Benches', 'Brakes', 'Clamps', 'Clutches', 'Connectors', 'Curtains', 'Cylinder Components', 'Cylinders', 'Dividers', 'Electric Wire, Cable and Cable Assemblies', 'Exchangers', 'Flowmeters']",https://www.thomasnet.com/products-services.html?cov=NA&what=hydraulic+cylinders&heading=21650809&cid=10099744&search_position=24&product_family=162457,,,Custom Manufacturer,"Distributor, Manufacturer, Service Company, Turnkey Systems Integrator",['Not Available'],,https://www.thomasnet.com/branches.html?what=hydraulic+cylinders&heading=21650809&cov=NA&cid=10099744&bloc=NA&WTZO=copro+biz+det,$10 - 24.9 Mil,1985,10-49,https://www.thomasnet.com/branchloc.html?cid=10099744&cov=NA&goto=%2Fprofile%2F10099744%2Fadvanced-fluid-systems-inc.html&heading=21650809&searchpos=24&what=hydraulic+cylinders
30716202,South Alliance,Custom Manufacturer,https://www.south-alliance.com/,"South El Monte, CA 91733",tel://626-575-3392,"Custom manufacturer of hydraulic type cylinders. Various types include single and double acting, tie rod, welded mounting, magnetic piston and inch/metric cylinders. Capabilities include machining, fabrication, welding, repair, engineering, designing, cutting, bending, forming, punching and shearing.
Additional Hydraulic Cylinders details","Company Description by Thomasnet
AS9100D and ISO 9001:2015 registered custom manufacturer of precision machined components and assemblies. Serving the aerospace, defense, space, medical, high-tech, automotive and commercial industries. CNC Machining capabilities include prototype, custom and production services. Additional services include custom metal fabrication, welding, assembly, finishing and turnkey solutions.
Company Description by South Alliance
Since our modest beginnings in 1989, South Alliance has built a reputation for excellence and reliability. South Alliance specializes in production machining, general machining services, custom metal fabrication, and industrial repair services. With nearly 30 years in the industry, we have refined our processes and techniques in order to provide high quality products and services. From concept to production and from cylinder repacking to machine redesign, South Alliance can provide complete costeffective solutions. Our team of machinist, fabricators, technicians, and engineers, recognize how time-sensitive projects can be and we are committed to completing your project accurately and on-time. This applies to all aspects of our work from all machining services, custom metal fabrication, and repair services.","['Cylinders: Hydraulic', 'Cylinders', 'Cylinders: Aluminum', 'Cylinders: Custom', 'Cylinders: Hydraulic Telescopic', 'Cylinders: Hydraulic, Adjustable Stroke', 'Cylinders: Hydraulic, Position Sensing', 'Cylinders: Stainless Steel', 'Cylinders: Tie-Rod', 'Cylinders: Welded']","['Machining', 'Anchors', 'Assemblies', 'Assembly Services', 'Automotive Parts', 'Balancing Services', 'Bending Services', 'Broaching Services', 'Bushings', 'Chains', 'Cutting Services', 'Cylinders', 'Electrical Components', 'Ends', 'Engineering Services', 'Fabrication Services', 'Forming Services', 'Guards', 'Guides', 'Hardware']",https://www.thomasnet.com/products-services.html?cov=NA&heading=21650809&what=hydraulic+cylinders&cid=30716202&search_position=25&product_family=151461,,,Custom Manufacturer,"Manufacturer, Service Company","['Enrique Hidalgo, G.M.']",,,$1 - 4.9 Mil,1988,10-49,https://www.thomasnet.com/profile/30716202/south-alliance.html?cid=30716202&cov=NA&heading=21650809&searchpos=25&what=hydraulic+cylinders
